{
  "schemaVersion": "2.0.0",
  "revision": 3,
  "writerId": "44444444-4444-4444-8444-444444444444",
  "mutationId": "55555555-5555-4555-8555-555555555555",
  "updatedAt": "2026-08-06T00:00:00.000Z",
  "expiresAt": "2026-09-05T00:00:00.000Z",
  "items": [
    {
      "lineKind": "configured_product",
      "entryId": "33333333-3333-4333-8333-333333333333",
      "createdAt": "2026-08-05T01:00:00.000Z",
      "product": {
        "model": "FGD X15+PVC",
        "name": "FGD X15+PVC Track",
        "publicPath": "/products/fgd-x15-pvc/",
        "image": { "url": "/test-candidates/fgd-x15-protected.png", "width": 800, "height": 800, "alt": "Protected test candidate" }
      },
      "selection": { "type": "standard", "lengthMeters": 6, "color": { "code": "ivory-white", "label": "Ivory White" } },
      "packaging": { "basePackaging": { "label": "Standard Export Packaging" }, "logoPrinting": false, "protectionArrangement": null },
      "quantityUnit": "piece",
      "quantity": 2
    },
    {
      "lineKind": "catalog_accessory",
      "entryId": "66666666-6666-4666-8666-666666666666",
      "createdAt": "2026-08-06T00:00:00.000Z",
      "product": {
        "model": "TASK-023 Accessory Beta",
        "name": "Accessory Beta",
        "image": { "url": "/test-candidates/fgd-x15-protected.png", "width": 800, "height": 800, "alt": "Protected test candidate" }
      },
      "catalogPath": "/products/accessories/test-candidates/",
      "quantityUnit": "piece",
      "quantity": 3
    }
  ]
}
